{
  "$schema": "https://json-schema.org/draft/2020-12/schema",
  "$id": "https://payasyoumaintain.com/schemas/premium-response/v1.2.2",
  "title": "Premium Response",
  "description": "Response payload from the pricing-policy service containing the computed premium breakdown.",
  "type": "object",
  "required": [
    "request_id",
    "vehicle_id",
    "policy_id",
    "base_premium",
    "dynamic_multiplier",
    "final_premium",
    "currency",
    "computed_at"
  ],
  "properties": {
    "request_id": {
      "type": "string",
      "format": "uuid",
      "description": "Echoed idempotency key from the corresponding premium request."
    },
    "vehicle_id": {
      "type": "string",
      "format": "uuid",
      "description": "Identifier of the priced vehicle."
    },
    "policy_id": {
      "type": "string",
      "format": "uuid",
      "description": "Identifier of the policy this premium applies to."
    },
    "base_premium": {
      "type": "number",
      "minimum": 0,
      "description": "Base premium amount before dynamic adjustments, derived from actuarial tables."
    },
    "dynamic_multiplier": {
      "type": "number",
      "minimum": 0,
      "description": "Multiplier applied to the base premium based on risk scores and behavioural incentives. Values < 1 indicate a discount; > 1 indicate a surcharge."
    },
    "final_premium": {
      "type": "number",
      "minimum": 0,
      "description": "Final premium amount (base_premium × dynamic_multiplier), after rounding and regulatory floors/caps."
    },
    "currency": {
      "type": "string",
      "pattern": "^[A-Z]{3}$",
      "description": "ISO-4217 currency code (e.g. 'INR', 'USD', 'GBP')."
    },
    "discount_breakdown": {
      "type": "array",
      "items": {
        "type": "object",
        "required": ["reason", "adjustment_pct"],
        "properties": {
          "reason": {
            "type": "string",
            "description": "Human-readable reason for the adjustment (e.g. 'safe_driving_discount', 'overdue_maintenance_surcharge')."
          },
          "adjustment_pct": {
            "type": "number",
            "description": "Percentage adjustment. Negative = discount, positive = surcharge."
          }
        },
        "additionalProperties": false
      },
      "description": "Itemised breakdown of adjustments that contribute to the dynamic multiplier (optional)."
    },
    "valid_until": {
      "type": "string",
      "format": "date-time",
      "description": "ISO-8601 timestamp after which this quote expires and must be re-computed."
    },
    "computed_at": {
      "type": "string",
      "format": "date-time",
      "description": "ISO-8601 timestamp of when this premium was computed."
    },
    "methodology_note": {
      "type": "string",
      "description": "Explanatory actuarial or methodology transparency note accompanying the calculated premium."
    },
    "score_detail": {
      "type": "object",
      "description": "Risk scoring details that informed the premium calculation.",
      "required": ["usage_score", "maintenance_score", "composite_score"],
      "properties": {
        "usage_score": { "type": ["number", "null"], "description": "0-100 usage score. Null when no trip data exists." },
        "maintenance_score": { "type": ["number", "null"], "description": "0-100 maintenance score. Null when health_status is 'insufficient_data' or 'not_evaluated'." },
        "composite_score": { "type": ["number", "null"], "description": "0-100 overall composite score. Null unless both component scores exist." },
        "health_status": {
          "type": "string",
          "enum": ["scored", "insufficient_data", "not_evaluated"],
          "description": "Whether a vehicle health score could be computed. 'scored' when events exist, 'insufficient_data' when no service events are on file, 'not_evaluated' when tracking consent is not established or vehicle is unregistered."
        },
        "vehicle_health_score": {
          "type": ["number", "null"],
          "minimum": 0,
          "maximum": 100,
          "description": "Deterministic vehicle health score (0-100). Null when health_status is 'insufficient_data' or 'not_evaluated'."
        },
        "health_confidence": {
          "type": ["string", "null"],
          "enum": ["verified", "unverified_self_reported", null],
          "description": "'unverified_self_reported' when every contributing service record is self_upload; 'verified' otherwise; null when not evaluated."
        },
        "renewal_recommendation": {
          "type": "string",
          "description": "Advisory renewal recommendation text. Never phrased as a denial."
        },
        "has_open_recall": {
          "type": ["boolean", "null"],
          "description": "Open-recall flag from recall-status source. true/false when known; null when unknown/unavailable or not evaluated."
        },
        "data_flags": {
          "type": "array",
          "items": { "type": "string" },
          "description": "Data-quality and tracking consent flags, e.g. 'conflicting_records_detected', 'recall_status_unavailable', 'usage_data_unavailable', 'consent_not_given_usage', 'consent_not_given_maintenance', 'vehicle_not_registered', 'consent_status_unavailable'."
        },
        "contributing_factors": {
          "type": "array",
          "items": {
            "type": "object",
            "required": ["factor_name", "impact", "direction", "description"],
            "properties": {
              "factor_name": { "type": "string" },
              "impact": { "type": "number" },
              "direction": { "type": "string" },
              "description": { "type": "string" }
            },
            "additionalProperties": false
          }
        }
      },
      "additionalProperties": false
    },
    "pricing_basis": {
      "type": "object",
      "description": "Actuarial basis and vehicle profile attributes used to derive the base premium.",
      "required": [
        "source",
        "vehicle_segment_id",
        "ex_showroom_price_inr",
        "vehicle_age_years",
        "depreciation_factor",
        "idv",
        "ncb_pct"
      ],
      "properties": {
        "source": {
          "type": "string",
          "enum": ["registered", "demo_profile", "generic_default"],
          "description": "Source of vehicle profile parameters."
        },
        "vehicle_segment_id": {
          "type": ["string", "null"],
          "description": "Catalogue segment ID if registered or known, null otherwise."
        },
        "ex_showroom_price_inr": {
          "type": "number",
          "minimum": 0,
          "description": "Ex-showroom price in INR."
        },
        "vehicle_age_years": {
          "type": "integer",
          "minimum": 0,
          "description": "Vehicle age in completed years."
        },
        "depreciation_factor": {
          "type": "number",
          "minimum": 0,
          "maximum": 1,
          "description": "Depreciation rate applied to ex-showroom price to determine IDV."
        },
        "idv": {
          "type": "number",
          "minimum": 0,
          "description": "Insured Declared Value (IDV) in INR."
        },
        "ncb_pct": {
          "type": "number",
          "minimum": 0,
          "maximum": 100,
          "description": "No Claim Bonus discount in percentage points (e.g. 20.0 for 20%).",
          "examples": [20.0]
        }
      },
      "additionalProperties": false
    }
  },
  "additionalProperties": false
}
