{"currency":"INR","request_id":"0b3c8ff0-0221-4ddb-890d-b9ce55fbbe30","vehicle_id":"b2c3d4e5-f6a7-8901-bcde-f12345678901","policy_id":"4c4caec8-846d-31d6-af88-43c25c038aa4","base_premium":12480.0,"dynamic_multiplier":0.748,"final_premium":8401.54,"discount_breakdown":[{"reason":"no_claim_bonus","adjustment_pct":-10.0},{"reason":"risk_score_discount","adjustment_pct":-25.2}],"valid_until":"2026-11-10T08:40:54.883300490Z","computed_at":"2026-10-11T08:40:54.883300490Z","methodology_note":"Dynamic Risk Multiplier is illustrative, pending actuarial validation on real claims data (Phase A).","score_detail":{"usage_score":100.0,"maintenance_score":85.0,"composite_score":94.0,"health_status":"scored","vehicle_health_score":85.0,"health_confidence":"verified","renewal_recommendation":"Eligible for standard renewal - vehicle health profile is strong.","has_open_recall":false,"data_flags":[],"contributing_factors":[{"impact":0.5,"direction":"positive","description":"Vehicle is being serviced regularly.","factor_name":"regular_service"},{"impact":0.5,"direction":"negative","description":"No brake-related service on record within the last 24 months.","factor_name":"brake_service_gap"}]}}