{"currency":"INR","request_id":"2bb518ca-39de-4a54-b01c-8d670368d86d","vehicle_id":"99999999-9999-9999-9999-999999999999","policy_id":"6f26f16a-4be2-3580-8137-971154d4d537","base_premium":13650.0,"dynamic_multiplier":1.0,"final_premium":13650.0,"discount_breakdown":[{"reason":"cold_start_neutral","adjustment_pct":0.0}],"valid_until":"2026-11-10T13:30:20.929100705Z","computed_at":"2026-10-11T13:30:20.929100705Z","methodology_note":"Dynamic Risk Multiplier is illustrative, pending actuarial validation on real claims data (Phase A).","score_detail":{"usage_score":null,"maintenance_score":null,"composite_score":null,"health_status":"insufficient_data","vehicle_health_score":null,"health_confidence":null,"renewal_recommendation":"Schedule a baseline inspection to begin health tracking for this vehicle.","has_open_recall":false,"data_flags":["usage_data_unavailable"],"contributing_factors":[{"impact":0.0,"direction":"neutral","description":"Not enough data to determine specific risk factors.","factor_name":"insufficient_data"}]}}