{"currency":"INR","request_id":"daecda36-6b79-4742-b64f-cc7d9e54c4b7","vehicle_id":"f6298b64-a9a7-4ced-90bc-b1a727525407","policy_id":"d5cc005e-eae9-4cd9-b1f9-e32fe76f0278","base_premium":24960.0,"dynamic_multiplier":1.0,"final_premium":24960.0,"discount_breakdown":[{"reason":"cold_start_neutral","adjustment_pct":0.0}],"valid_until":"2026-11-20T17:27:14.298972756Z","computed_at":"2026-10-21T17:27:14.298972756Z","methodology_note":"Dynamic Risk Multiplier is illustrative, pending actuarial validation on real claims data (Phase A).","score_detail":{"usage_score":null,"maintenance_score":85.0,"composite_score":null,"health_status":"scored","vehicle_health_score":85.0,"health_confidence":"unverified_self_reported","renewal_recommendation":"Eligible for standard renewal - vehicle health profile is strong. Based on self-reported records only; we recommend confirming your next service through our partner network for a fully verified score.","has_open_recall":false,"data_flags":["usage_data_unavailable"],"contributing_factors":[{"impact":0.5,"direction":"positive","description":"Vehicle is being serviced regularly.","factor_name":"regular_service"},{"impact":0.5,"direction":"negative","description":"No brake-related service on record within the last 24 months.","factor_name":"brake_service_gap"}]},"pricing_basis":{"source":"registered","vehicle_segment_id":"sedan_mid","ex_showroom_price_inr":1200000,"vehicle_age_years":2,"depreciation_factor":0.8,"idv":960000.0,"ncb_pct":0.0}}