{"currency":"INR","request_id":"b58276c5-83cf-4730-aad0-17a5b3d58e29","vehicle_id":"a1b2c3d4-e5f6-7890-abcd-ef1234567890","policy_id":"c4632682-d406-3102-86b7-6a22ef09af5d","base_premium":24960.0,"dynamic_multiplier":0.7,"final_premium":13977.6,"discount_breakdown":[{"reason":"no_claim_bonus","adjustment_pct":-20.0},{"reason":"risk_score_discount","adjustment_pct":-30.0}],"valid_until":"2026-11-19T14:20:10.476208295Z","computed_at":"2026-10-20T14:20:10.476208295Z","methodology_note":"Dynamic Risk Multiplier is illustrative, pending actuarial validation on real claims data (Phase A).","score_detail":{"usage_score":100.0,"maintenance_score":100.0,"composite_score":100.0,"health_status":"scored","vehicle_health_score":100.0,"health_confidence":"verified","renewal_recommendation":"Eligible for standard renewal - vehicle health profile is strong.","has_open_recall":false,"data_flags":[],"contributing_factors":[{"impact":0.67,"direction":"positive","description":"Vehicle is being serviced regularly.","factor_name":"regular_service"},{"impact":0.33,"direction":"positive","description":"Smooth braking profile.","factor_name":"smooth_braking"}]},"pricing_basis":{"source":"demo_profile","vehicle_segment_id":"sedan_mid","ex_showroom_price_inr":1200000,"vehicle_age_years":2,"depreciation_factor":0.8,"idv":960000.0,"ncb_pct":20.0}}