{
  "currency": "INR",
  "request_id": "edbf392f-0cef-4f80-a42a-0416f2d5547e",
  "vehicle_id": "a1b2c3d4-e5f6-7890-abcd-ef1234567890",
  "policy_id": "c4632682-d406-3102-86b7-6a22ef09af5d",
  "base_premium": 24960.0,
  "dynamic_multiplier": 0.7,
  "final_premium": 13977.6,
  "discount_breakdown": [
    {
      "reason": "no_claim_bonus",
      "adjustment_pct": -20.0
    },
    {
      "reason": "risk_score_discount",
      "adjustment_pct": -30.0
    }
  ],
  "valid_until": "2026-11-10T08:40:54.832775127Z",
  "computed_at": "2026-10-11T08:40:54.832775127Z",
  "methodology_note": "Dynamic Risk Multiplier is illustrative, pending actuarial validation on real claims data (Phase A).",
  "score_detail": {
    "usage_score": 100.0,
    "maintenance_score": 100.0,
    "composite_score": 100.0,
    "health_status": "scored",
    "vehicle_health_score": 100.0,
    "health_confidence": "unverified_self_reported",
    "renewal_recommendation": "Eligible for standard renewal - vehicle health profile is strong.",
    "has_open_recall": false,
    "data_flags": [],
    "contributing_factors": [
      {
        "impact": 1.0,
        "direction": "positive",
        "description": "Vehicle is being serviced regularly.",
        "factor_name": "regular_service"
      }
    ]
  }
}