{"currency":"INR","request_id":"c06f33c0-12c6-4cba-ac05-cfb1ac42ab6c","vehicle_id":"3eb26312-4188-4b11-a697-658a41c56352","policy_id":"35a4b83c-9c14-413e-b80d-561bf9f7060c","base_premium":24960.0,"dynamic_multiplier":1.0,"final_premium":24960.0,"discount_breakdown":[{"reason":"cold_start_neutral","adjustment_pct":0.0}],"valid_until":"2026-11-19T14:20:10.406929404Z","computed_at":"2026-10-20T14:20:10.406929404Z","methodology_note":"Dynamic Risk Multiplier is illustrative, pending actuarial validation on real claims data (Phase A).","score_detail":{"usage_score":null,"maintenance_score":null,"composite_score":null,"health_status":"insufficient_data","vehicle_health_score":null,"health_confidence":null,"renewal_recommendation":"Schedule a baseline inspection to begin health tracking for this vehicle.","has_open_recall":false,"data_flags":["usage_data_unavailable"],"contributing_factors":[{"impact":0.0,"direction":"neutral","description":"Not enough data to determine specific risk factors.","factor_name":"insufficient_data"}]},"pricing_basis":{"source":"registered","vehicle_segment_id":"sedan_mid","ex_showroom_price_inr":1200000,"vehicle_age_years":2,"depreciation_factor":0.8,"idv":960000.0,"ncb_pct":0.0}}