{"currency":"INR","request_id":"e2f4c360-f40b-438e-9483-bf88e9669a00","vehicle_id":"d4e5f6a7-b8c9-0123-defa-234567890123","policy_id":"33c7f064-f8cf-3ee4-af52-1453fd8e713f","base_premium":11700.0,"dynamic_multiplier":0.748,"final_premium":6563.7,"discount_breakdown":[{"reason":"no_claim_bonus","adjustment_pct":-25.0},{"reason":"risk_score_discount","adjustment_pct":-25.2}],"valid_until":"2026-11-19T14:20:10.551921278Z","computed_at":"2026-10-20T14:20:10.551921278Z","methodology_note":"Dynamic Risk Multiplier is illustrative, pending actuarial validation on real claims data (Phase A).","score_detail":{"usage_score":100.0,"maintenance_score":85.0,"composite_score":94.0,"health_status":"scored","vehicle_health_score":85.0,"health_confidence":"unverified_self_reported","renewal_recommendation":"Eligible for standard renewal - vehicle health profile is strong. Based on self-reported records only; we recommend confirming your next service through our partner network for a fully verified score.","has_open_recall":false,"data_flags":[],"contributing_factors":[{"impact":0.5,"direction":"positive","description":"Vehicle is being serviced regularly.","factor_name":"regular_service"},{"impact":0.25,"direction":"negative","description":"Score capped: all service records are self-reported.","factor_name":"unverified_source_cap"},{"impact":0.25,"direction":"positive","description":"Smooth braking profile.","factor_name":"smooth_braking"}]},"pricing_basis":{"source":"demo_profile","vehicle_segment_id":"sedan_entry","ex_showroom_price_inr":900000,"vehicle_age_years":5,"depreciation_factor":0.5,"idv":450000.0,"ncb_pct":25.0}}