{"currency":"INR","request_id":"6cfcb356-9b79-4048-9f31-f1285d30c061","vehicle_id":"c3d4e5f6-a7b8-9012-cdef-123456789012","policy_id":"f613e582-17e0-37cf-b317-856cbca14248","base_premium":27300.0,"dynamic_multiplier":0.772,"final_premium":21075.6,"discount_breakdown":[{"reason":"risk_score_discount","adjustment_pct":-22.8}],"valid_until":"2026-11-10T13:30:20.840151941Z","computed_at":"2026-10-11T13:30:20.840151941Z","methodology_note":"Dynamic Risk Multiplier is illustrative, pending actuarial validation on real claims data (Phase A).","score_detail":{"usage_score":85.0,"maintenance_score":100.0,"composite_score":91.0,"health_status":"scored","vehicle_health_score":100.0,"health_confidence":"verified","renewal_recommendation":"Eligible for standard renewal - vehicle health profile is strong.","has_open_recall":false,"data_flags":["conflicting_records_detected"],"contributing_factors":[{"impact":0.33,"direction":"positive","description":"Vehicle is being serviced regularly.","factor_name":"regular_service"},{"impact":0.67,"direction":"negative","description":"Frequent harsh braking detected.","factor_name":"high_harsh_braking"}]}}