{"currency":"INR","request_id":"e47815a6-17e4-4f97-ace6-d23fb69eea79","vehicle_id":"3eb26312-4188-4b11-a697-658a41c56352","policy_id":"35a4b83c-9c14-413e-b80d-561bf9f7060c","base_premium":24960.0,"dynamic_multiplier":1.0,"final_premium":24960.0,"discount_breakdown":[{"reason":"standard_pricing_no_consent","adjustment_pct":0.0}],"valid_until":"2026-11-19T14:20:10.371035187Z","computed_at":"2026-10-20T14:20:10.371035187Z","methodology_note":"Standard non-personalised pricing applied (tracking consent not established).","score_detail":{"usage_score":null,"maintenance_score":null,"composite_score":null,"health_status":"not_evaluated","vehicle_health_score":null,"health_confidence":null,"renewal_recommendation":"Turn on usage and maintenance tracking to get a personalised premium and vehicle health recommendations.","has_open_recall":null,"data_flags":["consent_not_given_usage","consent_not_given_maintenance"],"contributing_factors":[{"impact":0.0,"direction":"neutral","description":"Tracking is disabled or consent could not be established.","factor_name":"tracking_off"}]},"pricing_basis":{"source":"registered","vehicle_segment_id":"sedan_mid","ex_showroom_price_inr":1200000,"vehicle_age_years":2,"depreciation_factor":0.8,"idv":960000.0,"ncb_pct":0.0}}