{"currency":"INR","request_id":"132879e2-40b6-4d84-8828-addf1bff302a","vehicle_id":"7961fa7e-a88f-44de-865a-49331e84d20c","policy_id":"3c6b9c6d-182c-4faf-b98e-4c69ab38e469","base_premium":13650.0,"dynamic_multiplier":1.0,"final_premium":13650.0,"discount_breakdown":[{"reason":"standard_pricing_no_consent","adjustment_pct":0.0}],"valid_until":"2026-11-19T14:20:10.426770723Z","computed_at":"2026-10-20T14:20:10.426770723Z","methodology_note":"Standard non-personalised pricing applied (tracking consent not established).","score_detail":{"usage_score":null,"maintenance_score":null,"composite_score":null,"health_status":"not_evaluated","vehicle_health_score":null,"health_confidence":null,"renewal_recommendation":"Turn on usage and maintenance tracking to get a personalised premium and vehicle health recommendations.","has_open_recall":null,"data_flags":["consent_not_given_usage","consent_not_given_maintenance"],"contributing_factors":[{"impact":0.0,"direction":"neutral","description":"Tracking is disabled or consent could not be established.","factor_name":"tracking_off"}]},"pricing_basis":{"source":"generic_default","vehicle_segment_id":null,"ex_showroom_price_inr":750000,"vehicle_age_years":3,"depreciation_factor":0.7,"idv":525000.0,"ncb_pct":0.0}}