{"currency":"INR","request_id":"893d603a-9a1a-4705-bcc8-b8557afbb87d","vehicle_id":"14ffced6-a45f-4720-843f-751d4383a768","policy_id":"950d1d34-5b20-4fa6-b3a0-0d951b7980e7","base_premium":13650.0,"dynamic_multiplier":1.0,"final_premium":13650.0,"discount_breakdown":[{"reason":"cold_start_neutral","adjustment_pct":0.0}],"valid_until":"2026-11-16T11:30:51.014879687Z","computed_at":"2026-10-17T11:30:51.014879687Z","methodology_note":"Dynamic Risk Multiplier is illustrative, pending actuarial validation on real claims data (Phase A).","score_detail":{"usage_score":null,"maintenance_score":null,"composite_score":null,"health_status":"insufficient_data","vehicle_health_score":null,"health_confidence":null,"renewal_recommendation":"Schedule a baseline inspection to begin health tracking for this vehicle.","has_open_recall":false,"data_flags":["usage_data_unavailable"],"contributing_factors":[{"impact":0.0,"direction":"neutral","description":"Not enough data to determine specific risk factors.","factor_name":"insufficient_data"}]}}