{"currency":"INR","request_id":"1db30c92-33da-4e96-b10c-723f5e56b6f2","vehicle_id":"e5f6a7b8-c9d0-1234-efab-345678901234","policy_id":"a2aa245d-ecbc-3719-b180-cfc5ca5c3866","base_premium":44460.0,"dynamic_multiplier":1.0,"final_premium":44460.0,"discount_breakdown":[{"reason":"cold_start_neutral","adjustment_pct":0.0}],"valid_until":"2026-11-10T13:30:20.896457135Z","computed_at":"2026-10-11T13:30:20.896457135Z","methodology_note":"Dynamic Risk Multiplier is illustrative, pending actuarial validation on real claims data (Phase A).","score_detail":{"usage_score":null,"maintenance_score":null,"composite_score":null,"health_status":"insufficient_data","vehicle_health_score":null,"health_confidence":null,"renewal_recommendation":"Schedule a baseline inspection to begin health tracking for this vehicle.","has_open_recall":false,"data_flags":["usage_data_unavailable"],"contributing_factors":[{"impact":0.0,"direction":"neutral","description":"Not enough data to determine specific risk factors.","factor_name":"insufficient_data"}]}}