{"currency":"INR","request_id":"83b65618-6e61-43f7-b8c5-449621ff8af5","vehicle_id":"a1b2c3d4-e5f6-7890-abcd-ef1234567890","policy_id":"c4632682-d406-3102-86b7-6a22ef09af5d","base_premium":24960.0,"dynamic_multiplier":1.0,"final_premium":19968.0,"discount_breakdown":[{"reason":"no_claim_bonus","adjustment_pct":-20.0},{"reason":"standard_pricing_no_consent","adjustment_pct":0.0}],"valid_until":"2026-11-16T11:30:50.836433307Z","computed_at":"2026-10-17T11:30:50.836433307Z","methodology_note":"Standard non-personalised pricing applied (tracking consent not established).","score_detail":{"usage_score":null,"maintenance_score":null,"composite_score":null,"health_status":"not_evaluated","vehicle_health_score":null,"health_confidence":null,"renewal_recommendation":"Turn on usage and maintenance tracking to get a personalised premium and vehicle health recommendations.","has_open_recall":null,"data_flags":["consent_not_given_usage","consent_not_given_maintenance"],"contributing_factors":[{"impact":0.0,"direction":"neutral","description":"Tracking is disabled or consent could not be established.","factor_name":"tracking_off"}]}}